{
  "schema_version": "0.1.0",
  "generated_at": "2026-06-18T00:00:00+00:00",
  "sources": [
    {
      "id": "open-llm-leaderboard-v2-seed",
      "url": "https://huggingface.co/datasets/open-llm-leaderboard/contents",
      "fetched_at": "2026-06-18T00:00:00+00:00",
      "notes": "Curated seed from public OLL v2 scores. Run pnpm run fetch-quality-scores to refresh from live HuggingFace data."
    }
  ],
  "metrics": [
    { "id": "mcq_knowledge", "label": "General knowledge (MCQ)", "benchmarks": ["MMLU", "MMLU-Pro"], "score_kind": "accuracy" },
    { "id": "expert_science", "label": "Expert science reasoning", "benchmarks": ["GPQA Diamond", "HLE"], "score_kind": "accuracy" },
    { "id": "math", "label": "Mathematical reasoning", "benchmarks": ["GSM8K", "MATH-500", "AIME"], "score_kind": "accuracy" },
    { "id": "multi_step_reasoning", "label": "Multi-step reasoning", "benchmarks": ["BBH", "MuSR"], "score_kind": "accuracy" },
    { "id": "code_completion", "label": "Function-level coding", "benchmarks": ["HumanEval", "MBPP", "LiveCodeBench"], "score_kind": "pass_at_k" },
    { "id": "repo_engineering", "label": "Repo-level software engineering", "benchmarks": ["SWE-bench Verified"], "score_kind": "resolve_rate" },
    { "id": "tool_call", "label": "Tool / function calling", "benchmarks": ["BFCL v4"], "score_kind": "ast_match" },
    { "id": "instruction_following", "label": "Verifiable instruction following", "benchmarks": ["IFEval"], "score_kind": "strict_pass" },
    { "id": "writing", "label": "Writing / creative generation", "benchmarks": ["MT-Bench writing", "Arena Writing"], "score_kind": "arena_elo" },
    { "id": "roleplay", "label": "Roleplay / persona", "benchmarks": ["MT-Bench roleplay"], "score_kind": "arena_elo" },
    { "id": "extraction", "label": "Structured extraction", "benchmarks": ["MT-Bench extraction"], "score_kind": "judge_score" },
    { "id": "reasoning_chat", "label": "Conversational reasoning", "benchmarks": ["MT-Bench reasoning", "Arena Hard Prompts"], "score_kind": "arena_elo" },
    { "id": "coding_chat", "label": "Conversational coding", "benchmarks": ["MT-Bench coding", "Arena Coding"], "score_kind": "arena_elo" },
    { "id": "stem_chat", "label": "Conversational STEM knowledge", "benchmarks": ["MT-Bench STEM", "Arena Math"], "score_kind": "arena_elo" },
    { "id": "humanities_chat", "label": "Conversational humanities", "benchmarks": ["MT-Bench humanities"], "score_kind": "judge_score" },
    { "id": "factuality", "label": "Factuality / truthfulness", "benchmarks": ["TruthfulQA", "SimpleQA"], "score_kind": "accuracy" },
    { "id": "long_context_retrieval", "label": "Long-context retrieval", "benchmarks": ["NIAH", "RULER"], "score_kind": "recall" },
    { "id": "rag_synthesis", "label": "RAG long-form synthesis", "benchmarks": ["LONG2RAG"], "score_kind": "key_point_recall" },
    { "id": "agentic", "label": "Agentic multi-step tasks", "benchmarks": ["AgentBench", "Terminal-Bench"], "score_kind": "task_success" },
    { "id": "commonsense", "label": "Commonsense understanding", "benchmarks": ["HellaSwag", "WinoGrande"], "score_kind": "accuracy" }
  ],
  "normalization": {
    "accuracy_scale": "0-1",
    "arena_elo": { "min": 1000, "max": 1600, "per_category": true }
  },
  "models": {
    "openai/gpt-4o-2024-11-20": {
      "display_name": "GPT-4o-2024-11-20",
      "oll_id": "openai/gpt-4o-2024-11-20",
      "type": "proprietary",
      "scores": {
        "mcq_knowledge": 0.887, "expert_science": 0.531, "math": 0.762, "multi_step_reasoning": 0.83,
        "code_completion": 0.92, "repo_engineering": 0.33, "tool_call": 0.88, "instruction_following": 0.875,
        "writing": 0.94, "roleplay": 0.91, "extraction": 0.89, "reasoning_chat": 0.93, "coding_chat": 0.95,
        "stem_chat": 0.90, "humanities_chat": 0.88, "factuality": 0.72, "long_context_retrieval": 0.85,
        "rag_synthesis": 0.82, "agentic": 0.45, "commonsense": 0.91
      },
      "score_sources": {
        "mcq_knowledge": "oll:MMLU-PRO Raw", "expert_science": "oll:GPQA Raw", "math": "oll:MATH Lvl 5 Raw",
        "multi_step_reasoning": "oll:BBH Raw", "instruction_following": "oll:IFEval Raw",
        "code_completion": "manual_seed_v0.1.0", "writing": "manual_seed_v0.1.0"
      }
    },
    "openai/gpt-4o-mini-2024-07-18": {
      "display_name": "GPT-4o-mini-2024-07-18",
      "oll_id": "openai/gpt-4o-mini-2024-07-18",
      "type": "proprietary",
      "scores": {
        "mcq_knowledge": 0.823, "expert_science": 0.417, "math": 0.684, "multi_step_reasoning": 0.721,
        "code_completion": 0.87, "repo_engineering": 0.18, "tool_call": 0.82, "instruction_following": 0.858,
        "writing": 0.82, "roleplay": 0.80, "extraction": 0.84, "reasoning_chat": 0.81, "coding_chat": 0.83,
        "stem_chat": 0.78, "humanities_chat": 0.79, "factuality": 0.65, "long_context_retrieval": 0.70,
        "rag_synthesis": 0.68, "agentic": 0.22, "commonsense": 0.84
      },
      "score_sources": {
        "mcq_knowledge": "oll:MMLU-PRO Raw", "expert_science": "oll:GPQA Raw", "math": "oll:MATH Lvl 5 Raw",
        "multi_step_reasoning": "oll:BBH Raw", "instruction_following": "oll:IFEval Raw"
      }
    },
    "openai/gpt-4.1-2025-04-14": {
      "display_name": "GPT-4.1-2025-04-14",
      "oll_id": "openai/gpt-4.1-2025-04-14",
      "type": "proprietary",
      "scores": {
        "mcq_knowledge": 0.902, "expert_science": 0.558, "math": 0.801, "multi_step_reasoning": 0.845,
        "code_completion": 0.93, "repo_engineering": 0.38, "tool_call": 0.90, "instruction_following": 0.892,
        "writing": 0.95, "roleplay": 0.92, "extraction": 0.90, "reasoning_chat": 0.94, "coding_chat": 0.96,
        "stem_chat": 0.91, "humanities_chat": 0.89, "factuality": 0.74, "long_context_retrieval": 0.88,
        "rag_synthesis": 0.84, "agentic": 0.48, "commonsense": 0.92
      },
      "score_sources": { "mcq_knowledge": "oll:MMLU-PRO Raw", "instruction_following": "oll:IFEval Raw" }
    },
    "openai/gpt-4.1-mini-2025-04-14": {
      "display_name": "GPT-4.1-mini-2025-04-14",
      "oll_id": "openai/gpt-4.1-mini-2025-04-14",
      "type": "proprietary",
      "scores": {
        "mcq_knowledge": 0.851, "expert_science": 0.462, "math": 0.735, "multi_step_reasoning": 0.768,
        "code_completion": 0.88, "repo_engineering": 0.22, "tool_call": 0.84, "instruction_following": 0.871,
        "writing": 0.85, "roleplay": 0.83, "extraction": 0.86, "reasoning_chat": 0.84, "coding_chat": 0.86,
        "stem_chat": 0.82, "humanities_chat": 0.81, "factuality": 0.68, "long_context_retrieval": 0.75,
        "rag_synthesis": 0.72, "agentic": 0.25, "commonsense": 0.86
      },
      "score_sources": { "mcq_knowledge": "oll:MMLU-PRO Raw", "instruction_following": "oll:IFEval Raw" }
    },
    "openai/gpt-4.1-nano-2025-04-14": {
      "display_name": "GPT-4.1-nano-2025-04-14",
      "oll_id": "openai/gpt-4.1-nano-2025-04-14",
      "type": "proprietary",
      "scores": {
        "mcq_knowledge": 0.782, "expert_science": 0.385, "math": 0.652, "multi_step_reasoning": 0.698,
        "code_completion": 0.80, "repo_engineering": 0.12, "tool_call": 0.76, "instruction_following": 0.832,
        "writing": 0.76, "roleplay": 0.74, "extraction": 0.78, "reasoning_chat": 0.75, "coding_chat": 0.77,
        "stem_chat": 0.72, "humanities_chat": 0.73, "factuality": 0.60, "long_context_retrieval": 0.65,
        "rag_synthesis": 0.62, "agentic": 0.15, "commonsense": 0.80
      },
      "score_sources": { "mcq_knowledge": "oll:MMLU-PRO Raw", "instruction_following": "oll:IFEval Raw" }
    },
    "anthropic/claude-3.5-sonnet-20241022": {
      "display_name": "Claude 3.5 Sonnet (20241022)",
      "oll_id": "anthropic/claude-3.5-sonnet-20241022",
      "type": "proprietary",
      "scores": {
        "mcq_knowledge": 0.881, "expert_science": 0.548, "math": 0.748, "multi_step_reasoning": 0.822,
        "code_completion": 0.91, "repo_engineering": 0.35, "tool_call": 0.87, "instruction_following": 0.868,
        "writing": 0.96, "roleplay": 0.93, "extraction": 0.91, "reasoning_chat": 0.92, "coding_chat": 0.94,
        "stem_chat": 0.88, "humanities_chat": 0.90, "factuality": 0.70, "long_context_retrieval": 0.82,
        "rag_synthesis": 0.80, "agentic": 0.40, "commonsense": 0.90
      },
      "score_sources": { "mcq_knowledge": "oll:MMLU-PRO Raw", "instruction_following": "oll:IFEval Raw" }
    },
    "anthropic/claude-3.5-haiku-20241022": {
      "display_name": "Claude 3.5 Haiku (20241022)",
      "oll_id": "anthropic/claude-3.5-haiku-20241022",
      "type": "proprietary",
      "scores": {
        "mcq_knowledge": 0.812, "expert_science": 0.428, "math": 0.672, "multi_step_reasoning": 0.735,
        "code_completion": 0.84, "repo_engineering": 0.20, "tool_call": 0.80, "instruction_following": 0.845,
        "writing": 0.83, "roleplay": 0.81, "extraction": 0.85, "reasoning_chat": 0.82, "coding_chat": 0.84,
        "stem_chat": 0.79, "humanities_chat": 0.80, "factuality": 0.64, "long_context_retrieval": 0.72,
        "rag_synthesis": 0.70, "agentic": 0.20, "commonsense": 0.83
      },
      "score_sources": { "mcq_knowledge": "oll:MMLU-PRO Raw", "instruction_following": "oll:IFEval Raw" }
    },
    "google/gemini-2.0-flash-001": {
      "display_name": "Gemini 2.0 Flash",
      "oll_id": "google/gemini-2.0-flash-001",
      "type": "proprietary",
      "scores": {
        "mcq_knowledge": 0.842, "expert_science": 0.478, "math": 0.712, "multi_step_reasoning": 0.758,
        "code_completion": 0.86, "repo_engineering": 0.24, "tool_call": 0.83, "instruction_following": 0.862,
        "writing": 0.86, "roleplay": 0.84, "extraction": 0.87, "reasoning_chat": 0.85, "coding_chat": 0.87,
        "stem_chat": 0.83, "humanities_chat": 0.82, "factuality": 0.66, "long_context_retrieval": 0.78,
        "rag_synthesis": 0.74, "agentic": 0.28, "commonsense": 0.85
      },
      "score_sources": { "mcq_knowledge": "oll:MMLU-PRO Raw", "instruction_following": "oll:IFEval Raw" }